{
  "$schema": "https://json-schema.org/draft/2020-12/schema",
  "$id": "https://schemas.ratemyrepresentatives.com/methodology-release-gate.schema.json",
  "title": "MethodologyReleaseGateV1",
  "type": "object",
  "additionalProperties": false,
  "required": [
    "schemaVersion",
    "policyVersion",
    "reportId",
    "generatedAt",
    "runtimeFlagEnabled",
    "approvedMethodologyVersion",
    "gates",
    "decision",
    "decisionReason"
  ],
  "properties": {
    "schemaVersion": { "const": "methodology-release-gate.v1" },
    "policyVersion": { "const": "light-mathematics-policy.v1" },
    "reportId": { "$ref": "#/$defs/id" },
    "generatedAt": { "type": "string", "format": "date-time" },
    "runtimeFlagEnabled": { "type": "boolean", "default": false },
    "approvedMethodologyVersion": {
      "oneOf": [{ "$ref": "#/$defs/id" }, { "type": "null" }]
    },
    "gates": { "$ref": "#/$defs/gates" },
    "decision": {
      "enum": ["disabled", "eligible_for_separate_enablement", "rejected"]
    },
    "decisionReason": { "type": "string", "minLength": 1 }
  },
  "allOf": [
    {
      "if": {
        "properties": { "runtimeFlagEnabled": { "const": false } },
        "required": ["runtimeFlagEnabled"]
      },
      "then": {
        "properties": {
          "decision": { "enum": ["disabled", "rejected"] }
        }
      }
    },
    {
      "if": {
        "properties": { "runtimeFlagEnabled": { "const": true } },
        "required": ["runtimeFlagEnabled"]
      },
      "then": {
        "properties": {
          "approvedMethodologyVersion": { "$ref": "#/$defs/id" },
          "decision": { "const": "eligible_for_separate_enablement" },
          "gates": {
            "type": "object",
            "properties": {
              "publicMethodologyReview": { "$ref": "#/$defs/approvedGate" },
              "sourceAndFactorAudit": { "$ref": "#/$defs/approvedGate" },
              "biasAndDisparateImpactReview": { "$ref": "#/$defs/approvedGate" },
              "adversarialAndManipulationTesting": { "$ref": "#/$defs/approvedGate" },
              "stabilityAndSmallDataTesting": { "$ref": "#/$defs/approvedGate" },
              "correctionAndSupersessionTesting": { "$ref": "#/$defs/approvedGate" },
              "privacyAndNoSocialCreditReview": { "$ref": "#/$defs/approvedGate" },
              "legalReview": { "$ref": "#/$defs/approvedGate" },
              "representativeResponseAndAppealBehavior": {
                "$ref": "#/$defs/approvedGate"
              },
              "publicConsultation": { "$ref": "#/$defs/approvedGate" },
              "reservedGovernanceApproval": { "$ref": "#/$defs/approvedGate" }
            }
          }
        }
      }
    },
    {
      "if": {
        "properties": { "decision": { "const": "eligible_for_separate_enablement" } },
        "required": ["decision"]
      },
      "then": {
        "properties": { "runtimeFlagEnabled": { "const": true } }
      }
    }
  ],
  "$defs": {
    "id": {
      "type": "string",
      "pattern": "^[a-zA-Z0-9][a-zA-Z0-9._:-]{0,191}$"
    },
    "gate": {
      "type": "object",
      "additionalProperties": false,
      "required": ["status", "evidenceReferences", "decidedAt", "publicReason"],
      "properties": {
        "status": { "enum": ["pending", "approved", "rejected"] },
        "evidenceReferences": {
          "type": "array",
          "uniqueItems": true,
          "items": { "type": "string", "format": "uri" }
        },
        "decidedAt": { "type": ["string", "null"], "format": "date-time" },
        "publicReason": { "type": "string", "minLength": 1 }
      },
      "allOf": [
        {
          "if": {
            "properties": { "status": { "const": "pending" } },
            "required": ["status"]
          },
          "then": {
            "properties": {
              "evidenceReferences": { "type": "array", "maxItems": 0 },
              "decidedAt": { "type": "null" }
            }
          }
        },
        {
          "if": {
            "properties": { "status": { "enum": ["approved", "rejected"] } },
            "required": ["status"]
          },
          "then": {
            "properties": {
              "evidenceReferences": { "type": "array", "minItems": 1 },
              "decidedAt": { "type": "string", "format": "date-time" }
            }
          }
        }
      ]
    },
    "approvedGate": {
      "allOf": [
        { "$ref": "#/$defs/gate" },
        {
          "type": "object",
          "properties": { "status": { "const": "approved" } }
        }
      ]
    },
    "gates": {
      "type": "object",
      "additionalProperties": false,
      "required": [
        "publicMethodologyReview",
        "sourceAndFactorAudit",
        "biasAndDisparateImpactReview",
        "adversarialAndManipulationTesting",
        "stabilityAndSmallDataTesting",
        "correctionAndSupersessionTesting",
        "privacyAndNoSocialCreditReview",
        "legalReview",
        "representativeResponseAndAppealBehavior",
        "publicConsultation",
        "reservedGovernanceApproval"
      ],
      "properties": {
        "publicMethodologyReview": { "$ref": "#/$defs/gate" },
        "sourceAndFactorAudit": { "$ref": "#/$defs/gate" },
        "biasAndDisparateImpactReview": { "$ref": "#/$defs/gate" },
        "adversarialAndManipulationTesting": { "$ref": "#/$defs/gate" },
        "stabilityAndSmallDataTesting": { "$ref": "#/$defs/gate" },
        "correctionAndSupersessionTesting": { "$ref": "#/$defs/gate" },
        "privacyAndNoSocialCreditReview": { "$ref": "#/$defs/gate" },
        "legalReview": { "$ref": "#/$defs/gate" },
        "representativeResponseAndAppealBehavior": { "$ref": "#/$defs/gate" },
        "publicConsultation": { "$ref": "#/$defs/gate" },
        "reservedGovernanceApproval": { "$ref": "#/$defs/gate" }
      }
    }
  }
}
